codigo,secao,tematica,pergunta,respostas
6.1,SEÇÃO 6 - CARACTERÍSTICAS CULTURAIS E AMBIENTAIS,Meio ambiente,"Quais desses impactos ambientais mais prejudicam sua renda, alimentação e jeito de viver e costumes?","resíduos do descarte da despesca da aquicultura (peixes e camarões); desmatamento, drenagem e aterro do mangue ou assoreamento dos rios; resíduos ou derramamento de óleo no mar, nas praias, estuários e rios; construções de fora e/ou grilagem de terras nas áreas de pesca e perda de acesso aos pesqueiros; da urbanização e/ou especulação imobiliária; impactos vindos da pesca esportiva e amadora e do turismo; impactos resultantes da aplicação da legislação ambiental (leis e normas, unidades de conservação e áreas de proteção); da pesca industrial; outros (quais?) [texto]"
6.2,SEÇÃO 6 - CARACTERÍSTICAS CULTURAIS E AMBIENTAIS,Meio ambiente,Você percebe se os locais de pesca estão poluídos ou contaminados?,Não; Um pouco; Muito
6.3,SEÇÃO 6 - CARACTERÍSTICAS CULTURAIS E AMBIENTAIS,Meio ambiente,"Você participa de redes, fóruns ou coletivos, movimentos sociais e comitês que discutem e/ou realizam ações sobre questões socioambientais, da biodiversidade e das mudanças climáticas?",sim; não; não sei responder
6.4,SEÇÃO 6 - CARACTERÍSTICAS CULTURAIS E AMBIENTAIS,Meio ambiente,"Você considera que sua região/território esteja sofrendo os efeitos das mudanças climáticas? Se sim, quais as principais alterações que você percebe?","mudança no comportamento do clima (chuvas mais intensas e fortes, estiagens e secas mais prolongadas que o normal, mais intensidade e força dos ventos); assoreamento dos rios, lagoas, lagos, mangues etc.; alteração no ciclo de vida/reprodução das espécies (mudança no tempo de desova, no tempo de vida, período de crescimento, de reprodução); desaparecimento de espécies e/ou surgimento de outras que não existiam; mudanças na temperatura das águas; mudanças na salinidade das águas; desregulação e mudança no nível das águas (níveis das marés, dos rios, lagos e açudes); cheias e secas dos mares, rios, lagos e açudes mais fortes e mais vezes que o normal; enchentes e secas mais intensas e frequentes; mudanças na vazão das águas; outros [texto]"
6.4.1,SEÇÃO 6 - CARACTERÍSTICAS CULTURAIS E AMBIENTAIS,Meio ambiente,Quais outras mudanças foram percebidas na pesca em sua região/território?,"o esforço para pescar mudou (tem que ir para mais longe, tem mais horas pescando)?; mudou a área de pesca?; mudou a quantidade de pescado (diminuiu ou aumentou)?; mudou o tamanho do pescado (diminuiu ou aumentou)?; você percebeu mudança nos períodos de defeso do pescado?; teve que mudar o tamanho da malha da rede"
6.5,SEÇÃO 6 - CARACTERÍSTICAS CULTURAIS E AMBIENTAIS,Meio ambiente,"Você já observou aumento da presença de espécies invasoras na sua área de pesca (como bagres, arraias, piranhas ou peixes invasores como o peixe-leão)?","Sim; Não; Cultura, saberes e celebrações"
6.6,SEÇÃO 6 - CARACTERÍSTICAS CULTURAIS E AMBIENTAIS,Meio ambiente,Com quem aprendeu a pescar/mariscar/preparar apetrechos?,"Pai e/ou mãe; Avós; Outros parentes; Vizinhos e/ou amigos; Em cursos, oficinas; Outros: [texto]"
6.7,SEÇÃO 6 - CARACTERÍSTICAS CULTURAIS E AMBIENTAIS,Meio ambiente,Sobre como você passa o que sabe,Eu ensino o que sei para minha família ou pessoas da comunidade.; Eu já dei aulas em cursos ou oficinas de pesca.; Eu não costumo ensinar ou nunca tive a oportunidade de passar o conhecimento.
6.8,SEÇÃO 6 - CARACTERÍSTICAS CULTURAIS E AMBIENTAIS,Meio ambiente,"Na sua comunidade há grupos artísticos e culturais? Se sim, quais? (múltiplas escolhas)",não tem; não sei se tem; teatro; percussão; pintura; marcenaria/carpintaria; danças tradicionais; música; artesanato; outros [texto]
